{
  "schemaVersion": 1,
  "protocol": "scion-lesson-kernel-blind-review-v1",
  "order": "B/A",
  "packetSha256": "104f281c8ee3ba9628bec7f436e9b6f97940865e8c8c1b572531d3a49265dc9a",
  "sessionId": "scion-v01654-batch-001-a369ac322a-b-a-71d90c7f-2f82-47f9-9db4-a151e8aeb385",
  "judge": {
    "model": "gpt-5.6-sol",
    "revision": "codex-cli 0.144.5",
    "runtime": "codex-cli-ephemeral-isolated-cleanroom"
  },
  "completedAt": "2026-07-19T19:51:45Z",
  "attestations": {
    "anonymousArtifactsOnly": true,
    "otherOrderUnavailable": true,
    "organizerMappingUnavailable": true
  },
  "decisions": [
    {
      "caseId": "scion-kernel-1711f0b21d56aa4e046c9307",
      "pairId": "scion-kernel-pair-ba4b0f928df2fad95aec59ab",
      "artifactSha256": {
        "A": "b99871993bee0f563d54738e54c1b56d83245a486bd97f12d869cd3a76de3d70",
        "B": "3e966588714e5686c7db025db4d4b0ce9331053875f15aaaa0de6cbdbf12e28f"
      },
      "scores": {
        "A": {
          "sourceFidelity": {
            "score": 4,
            "evidence": "Facts, terms, examples, scenario evidence, and answers stay within the three supplied claims."
          },
          "knowledgePrecision": {
            "score": 4,
            "evidence": "The terms accurately distinguish internal heat, the hydrological cycle, and their respective movements."
          },
          "scenarioReadiness": {
            "score": 4,
            "evidence": "The student must label two inspectable passages before a deadline using their locations and materials."
          },
          "assessmentCorrectness": {
            "score": 4,
            "evidence": "Both declared answers uniquely match their cited claims and agree with their explanations."
          },
          "choiceDiscriminability": {
            "score": 3,
            "evidence": "Choices are distinct, but several alternatives mix drivers, materials, and locations in imperfectly parallel forms."
          },
          "feedbackInstructionality": {
            "score": 4,
            "evidence": "Each explanation states the supported driver relation and contrasts it with the reversed or misassigned relation."
          },
          "internalCoherence": {
            "score": 4,
            "evidence": "Facts, terms, scenario labels, answer keys, citations, and explanations consistently assign each driver."
          }
        },
        "B": {
          "sourceFidelity": {
            "score": 2,
            "evidence": "Core facts are copied faithfully, but volcanic activity and deep mantle convection are not supplied claims."
          },
          "knowledgePrecision": {
            "score": 4,
            "evidence": "The three key-term entries accurately state and correct the supplied distinctions between the drivers."
          },
          "scenarioReadiness": {
            "score": 2,
            "evidence": "The scenario asks for a comparison under a source-only constraint but supplies vague analysis rather than a concrete field decision."
          },
          "assessmentCorrectness": {
            "score": 0,
            "evidence": "The second question declares the hydrological-cycle option although the cited fact and explanation identify internal heat."
          },
          "choiceDiscriminability": {
            "score": 3,
            "evidence": "The alternatives are distinct, though several are conspicuously reversed or causally circular rather than equally plausible."
          },
          "feedbackInstructionality": {
            "score": 1,
            "evidence": "The first explanation omits the hydrological evidence, and the second teaches internal heat while contradicting its declared answer."
          },
          "internalCoherence": {
            "score": 0,
            "evidence": "The second answer key selects option 0 while its explanation explicitly supports option 1."
          }
        }
      },
      "criticalDefects": {
        "A": [],
        "B": [
          "Unsupported factual examples introduce high volcanic activity and deep mantle convection beyond the supplied claims.",
          "The second question has an incorrect declared answer: option 0 is keyed instead of option 1.",
          "The second explanation contradicts its declared answer by identifying Earth's internal heat as responsible."
        ]
      },
      "decision": "A",
      "rationale": "A is fully source-bound, actionable, and assessment-consistent. B has unsupported scenario details and a decisive incorrect answer/explanation contradiction."
    },
    {
      "caseId": "scion-kernel-4ed7b918a8ad0fe66ff45257",
      "pairId": "scion-kernel-pair-5d40327da098b5050654ef4c",
      "artifactSha256": {
        "A": "6b44f2c15963412ce8dbd9e273aa5e4d4c5f5f7b816ec4092ddd016dedabae84",
        "B": "7a65a46857d3be76a490fb2871f49e7b63226387d9ea3dc8d54ee385c27af4bc"
      },
      "scores": {
        "A": {
          "sourceFidelity": {
            "score": 4,
            "evidence": "All facts, term distinctions, scenario observations, questions, and explanations restate supplied relations."
          },
          "knowledgePrecision": {
            "score": 4,
            "evidence": "Electric potential, potential difference, and electric-field direction are accurately distinguished and corrected."
          },
          "scenarioReadiness": {
            "score": 3,
            "evidence": "Two inspectable passages require explicit classifications, but the scenario offers little practical constraint or tension."
          },
          "assessmentCorrectness": {
            "score": 4,
            "evidence": "Both keyed options are uniquely correct, directly supported by their cited facts, and explanation-consistent."
          },
          "choiceDiscriminability": {
            "score": 3,
            "evidence": "The paired labels are strong, but the second question includes an awkward reversed-causality alternative."
          },
          "feedbackInstructionality": {
            "score": 4,
            "evidence": "Explanations identify the governing relation and repair confusion with electric potential or the wrong quantity."
          },
          "internalCoherence": {
            "score": 4,
            "evidence": "The facts, definitions, passage classifications, keys, citations, and explanations agree throughout."
          }
        },
        "B": {
          "sourceFidelity": {
            "score": 1,
            "evidence": "Terms and scenario add vectors, test-charge force, uniform fields, named points, and numerical voltages absent from the source."
          },
          "knowledgePrecision": {
            "score": 2,
            "evidence": "Potential and potential difference are mostly accurate, but the electric-field entry replaces the supplied decreasing-potential relation with outside content."
          },
          "scenarioReadiness": {
            "score": 1,
            "evidence": "It calls for calculating work but gives only two voltages and no charge magnitude or explicit decision output."
          },
          "assessmentCorrectness": {
            "score": 0,
            "evidence": "The second question keys the higher-potential option while both the source and explanation require decreasing or lower potential."
          },
          "choiceDiscriminability": {
            "score": 0,
            "evidence": "The second question contains two equivalent correct choices: toward lower potential and in the direction of decreasing potential."
          },
          "feedbackInstructionality": {
            "score": 1,
            "evidence": "Feedback repeats source statements without diagnosing alternatives, and the second explanation contradicts the keyed answer."
          },
          "internalCoherence": {
            "score": 0,
            "evidence": "The second key conflicts with its stem, source fact, explanation, and two duplicate lower-potential choices."
          }
        }
      },
      "criticalDefects": {
        "A": [],
        "B": [
          "Unsupported factual claims introduce vector/test-charge definitions, a uniform field, and force-direction content outside the source.",
          "The scenario invents named points and numerical potentials of 100 V and 50 V.",
          "The second question has an incorrect declared answer: option 0 says higher potential.",
          "The second explanation contradicts the declared answer by stating that the field points toward decreasing potential.",
          "Options 1 and 2 in the second question are duplicate correct alternatives, making the question ambiguous.",
          "The work-calculation scenario lacks the charge magnitude needed for a usable calculation decision."
        ]
      },
      "decision": "A",
      "rationale": "A remains faithful and consistently assesses all supplied distinctions. B adds extensive unsupported material and its second item is incorrectly keyed, contradictory, and ambiguous."
    }
  ]
}
