{
  "schemaVersion": 1,
  "protocol": "scion-lesson-kernel-blind-review-v1",
  "order": "A/B",
  "packetSha256": "60534146b79853e6c96f53a9ac9ccbe10a26474e8756dccc8c5ccb30093e4154",
  "sessionId": "scion-v01654-batch-006-4ebd3cb7ab-a-b-9b4a478b-d749-4f47-8197-22858c6ea8f9",
  "judge": {
    "model": "gpt-5.6-sol",
    "revision": "codex-cli 0.144.5",
    "runtime": "codex-cli-ephemeral-isolated-cleanroom"
  },
  "completedAt": "2026-07-19",
  "attestations": {
    "anonymousArtifactsOnly": true,
    "otherOrderUnavailable": true,
    "organizerMappingUnavailable": true
  },
  "decisions": [
    {
      "caseId": "scion-kernel-560fc51a1b084a9a84a854e1",
      "pairId": "scion-kernel-pair-858f18f7ea738a52b3832dc1",
      "artifactSha256": {
        "A": "30a9c5c6dc514f235218c7fb90ac519395f3a9f4f2d10afc4daceddc9499df40",
        "B": "27420efbd10fbf5d79eef44c71a0da8a984a4a89d897fca808bbd18726361afc"
      },
      "scores": {
        "A": {
          "sourceFidelity": {
            "score": 4,
            "evidence": "The function fact directly matches the supplied definition, and the local-variable access failure follows the supplied scope claims."
          },
          "knowledgePrecision": {
            "score": 2,
            "evidence": "The single fact is accurate, but it omits the supplied definition syntax, explicit scope definition, and local/global distinction."
          },
          "scenarioReadiness": {
            "score": 2,
            "evidence": "The programmer can inspect where total is created and accessed, but the scenario supplies the diagnosis and offers no meaningful constraint or tension."
          },
          "assessmentCorrectness": {
            "score": 0,
            "evidence": "The artifact contains no assessment questions, declared answers, fact citations, or answer explanations to verify."
          },
          "choiceDiscriminability": {
            "score": 0,
            "evidence": "The artifact supplies no answer choices, so distinctness, plausibility, parallelism, and ambiguity cannot be demonstrated."
          },
          "feedbackInstructionality": {
            "score": 0,
            "evidence": "No assessment feedback explains a supported answer or repairs a competing misconception."
          },
          "internalCoherence": {
            "score": 2,
            "evidence": "The fact and scenario do not contradict each other, but absent terms, questions, keys, citations, and explanations leave coherence largely unestablished."
          }
        },
        "B": {
          "sourceFidelity": {
            "score": 4,
            "evidence": "Its facts, definitions, examples, scenario, and answers remain within the supplied claims about function definition, calls, and variable scope."
          },
          "knowledgePrecision": {
            "score": 3,
            "evidence": "The five facts accurately cover the source and the terms distinguish behavior from scope, though saying a later call is required can blur defining a function with running it."
          },
          "scenarioReadiness": {
            "score": 4,
            "evidence": "The team must choose between score and limit using inspectable creation locations while obeying the explicit constraint that the code cannot be changed."
          },
          "assessmentCorrectness": {
            "score": 4,
            "evidence": "Both declared answers are uniquely supported by their cited facts: functions wait for calls, and inside-function names remain local."
          },
          "choiceDiscriminability": {
            "score": 3,
            "evidence": "Each question has four distinct, nonduplicative options, although several distractors use extreme automatic or every-line claims that make them relatively easy to reject."
          },
          "feedbackInstructionality": {
            "score": 3,
            "evidence": "Both explanations state the governing rule and repair a misconception, but the first refers vaguely to a nearby distractor instead of identifying its precise faulty claim."
          },
          "internalCoherence": {
            "score": 3,
            "evidence": "Facts, terms, scenario, keys, citations, and explanations consistently distinguish callable functions and local versus global names, with only minor ambiguity about whether calling is required to define a function."
          }
        }
      },
      "criticalDefects": {
        "A": [],
        "B": []
      },
      "decision": "B",
      "rationale": "B is substantially more instructionally complete: it covers all supplied claims, presents a constrained evidence-based scope decision, and includes two correctly keyed assessments with distinct choices and explanatory feedback. A is source-consistent but too sparse to establish assessment correctness, choice quality, or feedback instructionality."
    }
  ]
}
