{
  "schemaVersion": 1,
  "protocol": "scion-lesson-kernel-blind-review-v1",
  "order": "B/A",
  "packetSha256": "d67f7d0e522fea8e17416c9953e1c43b699845808d33f6f09a6154b842a3683d",
  "sessionId": "scion-v01654-batch-001-c19b5a028d-b-a-905249cd-9433-4c78-97a0-e1b96b340715",
  "judge": {
    "model": "gpt-5.6-sol",
    "revision": "codex-cli 0.144.5",
    "runtime": "codex-cli-ephemeral-isolated-cleanroom"
  },
  "completedAt": "2026-07-19T19:00:00.000Z",
  "attestations": {
    "anonymousArtifactsOnly": true,
    "otherOrderUnavailable": true,
    "organizerMappingUnavailable": true
  },
  "decisions": [
    {
      "caseId": "scion-kernel-008bab43da5c7cb7977b1891",
      "pairId": "scion-kernel-pair-1dbded9472ff4c011d739feb",
      "artifactSha256": {
        "A": "20fea4aa722dd02128945a6dd9f79e7ef8610ac6709f0675499c27f18638492d",
        "B": "8b121408061f04c82be46185c0fec45324a3785054a25365ca5d549bb7c6c3d7"
      },
      "scores": {
        "A": {
          "sourceFidelity": {
            "score": 4,
            "evidence": "The facts, term definitions, examples, and answers remain within the supplied persona, need, story, and traceability claims."
          },
          "knowledgePrecision": {
            "score": 4,
            "evidence": "The three terms are accurately distinguished, and each misconception receives a direct, useful correction."
          },
          "scenarioReadiness": {
            "score": 4,
            "evidence": "The scenario supplies a persona, a stable account-information need, a quick-filter story, and a concrete linkage decision before approval."
          },
          "assessmentCorrectness": {
            "score": 2,
            "evidence": "Both declared answers are substantively correct, but the second question cites fact index 3, which does not support traceability or evaluation."
          },
          "choiceDiscriminability": {
            "score": 3,
            "evidence": "All options are distinct and the answers are unique, although several mockup and visual-style distractors are conspicuously weak."
          },
          "feedbackInstructionality": {
            "score": 4,
            "evidence": "Each explanation identifies the relevant distinction or linkage and explains why detachment or category confusion fails."
          },
          "internalCoherence": {
            "score": 3,
            "evidence": "The lesson consistently connects personas, needs, and stories, but the second question's fact citation does not support its explanation."
          }
        },
        "B": {
          "sourceFidelity": {
            "score": 4,
            "evidence": "The five facts closely reproduce all supplied claims, and no invented named example or unsupported causal assertion appears."
          },
          "knowledgePrecision": {
            "score": 3,
            "evidence": "Definitions and misconceptions are accurate, but the examples and corrections mostly repeat definitions instead of adding usable distinctions."
          },
          "scenarioReadiness": {
            "score": 1,
            "evidence": "The scenario names an alignment goal but supplies no concrete persona content, user-story detail, or inspectable evidence for the decision."
          },
          "assessmentCorrectness": {
            "score": 1,
            "evidence": "The first answer is correct despite a mismatched fact citation; the second key is not established by its premise and is not uniquely defensible."
          },
          "choiceDiscriminability": {
            "score": 1,
            "evidence": "The first item uses giveaway absolutes, while the second offers overlapping persona descriptions and no option that resolves its premise."
          },
          "feedbackInstructionality": {
            "score": 0,
            "evidence": "Both explanations stop at the literal unfinished instruction 'then correct the closest distractor' and never perform that correction."
          },
          "internalCoherence": {
            "score": 1,
            "evidence": "The scenario compares personas with stories instead of tracing stories to needs, citations miss supporting facts, and the second key conflicts with its premise."
          }
        }
      },
      "criticalDefects": {
        "A": [],
        "B": [
          "The second question's declared answer is not supported by its premise, and overlapping alternatives prevent a uniquely correct response.",
          "Both explanations contain the unfinished instruction 'then correct the closest distractor,' leaving the instructional feedback truncated.",
          "The scenario supplies no concrete persona or user-story evidence from which the stated design-alignment decision can be made."
        ]
      },
      "decision": "A",
      "rationale": "Artifact A is the clear winner because it provides accurate, differentiated instruction, an evidence-bearing scenario, uniquely correct answers, and complete feedback. Its second citation is defective, but Artifact B additionally has an unusable scenario, an invalid or ambiguous second key, and visibly truncated explanations."
    }
  ]
}
