{
  "schemaVersion": 1,
  "protocol": "scion-lesson-kernel-blind-review-v1",
  "order": "B/A",
  "packetSha256": "36207c362cd4d088418738faff8e1cc2af58ef37069f117213fe9fe075636175",
  "sessionId": "scion-v01654-batch-008-21f78870bf-b-a-c9c5695c-ca1c-439a-87fd-6046015c099e",
  "judge": {
    "model": "gpt-5.6-sol",
    "revision": "codex-cli 0.144.5",
    "runtime": "codex-cli-ephemeral-isolated-cleanroom"
  },
  "completedAt": "2026-07-19T19:00:00.000Z",
  "attestations": {
    "anonymousArtifactsOnly": true,
    "otherOrderUnavailable": true,
    "organizerMappingUnavailable": true
  },
  "decisions": [
    {
      "caseId": "scion-kernel-5927960b1d8e077b7f49f8d4",
      "pairId": "scion-kernel-pair-b0468085a2d735a1dce11a89",
      "artifactSha256": {
        "A": "7d96923d9e4a6577b7a3ca778b266802c030c566cb9fbb812ecc6c6e96e54622",
        "B": "397a83e1852b3a8ae21f66085bb52d09c36b4341faadbd40406151038c32e13a"
      },
      "scores": {
        "A": {
          "sourceFidelity": {
            "score": 3,
            "evidence": "The flux and symmetry claims track the packet, but the Gaussian-surface correction adds that it is purely mathematical and cannot alter charges."
          },
          "knowledgePrecision": {
            "score": 4,
            "evidence": "The three terms are distinct, accurately defined, and directly repair confusion between net flux and pointwise field values."
          },
          "scenarioReadiness": {
            "score": 4,
            "evidence": "The learner must compare a zero charge tally with nonuniform field arrows while retaining a closed surface and decide which conclusion follows."
          },
          "assessmentCorrectness": {
            "score": 3,
            "evidence": "Both keyed options are uniquely correct, although the first question cites fact 2 while its field-variation clause is stated more directly in fact 3."
          },
          "choiceDiscriminability": {
            "score": 4,
            "evidence": "Each question supplies four distinct and parallel interpretations, including plausible misconceptions about zero field, symmetry, and surface choice."
          },
          "feedbackInstructionality": {
            "score": 4,
            "evidence": "Both explanations identify the supporting principle and explicitly repair the closest misconception without mentioning answer position."
          },
          "internalCoherence": {
            "score": 4,
            "evidence": "The facts, scenario evidence, keyed answers, and explanations consistently distinguish zero net flux from an everywhere-zero field."
          }
        },
        "B": {
          "sourceFidelity": {
            "score": 1,
            "evidence": "Although several claims reproduce the packet, the artifact adds electrostatics framing, a point charge, conducting shell, radii, and an unspecified flux constant."
          },
          "knowledgePrecision": {
            "score": 3,
            "evidence": "The term definitions are mostly accurate and distinct, but one fact is duplicated and the claim that symmetry is mandatory overstates the supplied usefulness condition."
          },
          "scenarioReadiness": {
            "score": 2,
            "evidence": "The setup provides a sphere, charge, flux observation, and constant-field constraint, but its decision is generic and its added shell and formula are unsupported."
          },
          "assessmentCorrectness": {
            "score": 0,
            "evidence": "Question 1 keys the expressly false everywhere-zero-field claim, and question 2 keys an unsupported assertion that the flux calculation is always correct."
          },
          "choiceDiscriminability": {
            "score": 0,
            "evidence": "Question 1 omits the correct zero-net-flux conclusion, while question 2 makes the premise and alternatives conflict over whether the enclosed charge is nonzero."
          },
          "feedbackInstructionality": {
            "score": 0,
            "evidence": "The first explanation refutes its own keyed answer, and the second merely restates the law without justifying the key or repairing a distractor."
          },
          "internalCoherence": {
            "score": 0,
            "evidence": "The first key directly contradicts its explanation, the supplied zero-charge distinction, and the artifact's own Gauss's-law term correction."
          }
        }
      },
      "criticalDefects": {
        "A": [
          "The Gaussian-surface correction makes the unsupported causal claim that the chosen surface cannot alter the charges."
        ],
        "B": [
          "The scenario invents a point charge Q, conducting shell, radii, constant-field requirement, and Q divided by an unspecified constant beyond the supplied claims.",
          "Question 1 declares that zero enclosed charge forces the field to be zero everywhere, contradicting both the source and its own explanation.",
          "Question 2 declares an option asserting that the flux calculation is always correct even though that assertion is unsupported and does not resolve the stated nonzero-charge conflict."
        ]
      },
      "decision": "A",
      "rationale": "Artifact A is decisively stronger: it presents a usable evidence-based decision, correct keys, discriminating choices, and explanations that repair the central misconception. Artifact B contains a direct key/explanation contradiction, a second defective key, missing or ambiguous correct alternatives, and extensive unsupported scenario detail."
    }
  ]
}
